#,Name,NameYear,Year,Team,Position,Snaps,Overall Rating,Pass Block Rating,Screen Block Rating,Run Block Rating,Penalty Rating,# of Pen,QB Sk,QB Ht,QB Hu,Passing Plays,Pass Block Snaps,Pass Block %,Sacks Allowed,Hits Allowed,Hurries Allowed,Total Pressure Allowed,PBE
1, John Sullivan, John Sullivan2012,2012,MIN,C,1056,27.2,3.5,1.5,20.9,1.3,Feb-00,2,2,8,556,555,99.8,2,2,8,12,98.3
2, Brian De La Puente, Brian De La Puente2012,2012,NO,C,1134,23,5.6,2.5,13.6,1.3,Mar-00,2,4,10,700,700,100,2,4,10,16,98.2
3, Max Unger, Max Unger2012,2012,SEA,C,1013,22.7,1.3,1.5,18.1,1.8,1-Mar,0,3,9,478,478,100,0,3,9,12,98.1
4, Will Montgomery, Will Montgomery2012,2012,WAS,C,1056,21.4,4.1,1,16,0.3,1-Mar,1,2,9,517,517,100,1,2,9,12,98.2
4, Ryan Wendell, Ryan Wendell2012,2012,NE,C,1249,21.4,-6.1,1.5,24.2,1.8,Feb-00,5,2,18,674,674,100,5,2,18,25,97
6, Nick Mangold, Nick Mangold2012,2012,NYJ,C,1088,20.5,2.7,0.5,15.8,1.5,Feb-00,3,2,8,554,554,100,3,2,8,13,98.1
7, Chris Myers, Chris Myers2012,2012,HST,C,1150,19.3,6.8,2.5,9.5,0.5,1-Apr,2,2,8,583,583,100,2,2,8,12,98.4
8, Mike Pouncey, Mike Pouncey2012,2012,MIA,C,1053,17.6,6.7,1.5,10.1,-0.7,May-00,2,2,3,555,555,100,2,2,3,7,99
9, Alex Mack, Alex Mack2012,2012,CLV,C,1064,14.9,5.6,1,14.1,-5.8,1-Sep,3,2,8,618,618,100,3,2,8,13,98.3
10, Jonathan Goodwin, Jonathan Goodwin2012,2012,SF,C,1007,11.7,-0.6,0.5,10.6,1.2,Mar-00,0,4,14,513,511,99.6,0,4,14,18,97.4
11, Fernando Velasco, Fernando Velasco2012,2012,TEN,C,843,11.2,1.9,0,7.8,1.5,Jan-00,0,2,9,528,528,100,0,2,9,11,98.4
12, Maurkice Pouncey, Maurkice Pouncey2012,2012,PIT,C,817,9.5,2.3,2,3.7,1.5,Jan-00,2,1,8,456,455,99.8,2,1,8,11,98.1
13, Dominic Raiola, Dominic Raiola2012,2012,DET,C,1230,9.1,6.2,1,0.2,1.7,Feb-00,3,2,12,789,789,100,3,2,12,17,98.3
14, Ryan Lilja, Ryan Lilja2012,2012,KC,C,781,7.7,-3.2,-0.5,9.5,1.9,Jan-00,1,5,7,375,375,100,1,5,7,13,97.3
15, Stefen Wisniewski, Stefen Wisniewski2012,2012,OAK,C,1034,7.5,9,1,-0.1,-2.4,1-Jun,0,3,5,618,618,100,0,3,5,8,99
16, A.Q. Shipley, A.Q. Shipley2012,2012,IND,C,455,6.9,2.3,0.5,2.7,1.4,0-0,1,2,2,246,246,100,1,2,2,5,98.4
17, Todd McClure, Todd McClure2012,2012,ATL,C,1059,6.7,-1.3,2,5.7,0.3,Apr-00,5,4,11,661,661,100,5,4,11,20,97.5
18, Robert Turner, Robert Turner2012,2012,SL,C,613,6.3,6.4,0.5,0.5,-1.1,1-Mar,0,1,2,343,343,100,0,1,2,3,99.3
19, Ryan Cook, Ryan Cook2012,2012,DAL,C,837,5.7,-0.8,0.5,7.4,-1.4,1-Apr,1,4,12,527,527,100,1,4,12,17,97.5
20, Matt Birk, Matt Birk2012,2012,BLT,C,1047,5.6,-5.3,2,7.6,1.3,Feb-00,3,5,17,573,573,100,3,5,17,25,96.6
21, J.D. Walton, J.D. Walton2012,2012,DEN,C,256,5.1,3.2,0.5,1.6,-0.2,Jan-00,0,0,1,147,147,100,0,0,1,1,99.5
22, Dan Koppen, Dan Koppen2012,2012,DEN,C,908,5,5.2,0,-2,1.8,Jan-00,1,0,6,467,467,100,1,0,6,7,98.8
23, Phil Costa, Phil Costa2012,2012,DAL,C,126,4.6,1.1,0,3.1,0.4,0-0,0,0,1,55,55,100,0,0,1,1,98.6
23, Rodney Hudson, Rodney Hudson2012,2012,KC,C,185,4.6,2.4,0.5,1.2,0.5,0-0,0,0,1,108,108,100,0,0,1,1,99.3
25, Jason Kelce, Jason Kelce2012,2012,PHI,C,138,4.5,1.2,0,3.9,-0.6,Jan-00,0,1,0,79,79,100,0,1,0,1,99.1
26, David Baas, David Baas2012,2012,NYG,C,1018,3.3,-9.1,1,10.2,1.2,Feb-00,1,7,16,563,563,100,1,7,16,24,96.8
27, Evan Dietrich-Smith, Evan Dietrich-Smith2012,2012,GB,C,155,2.9,1.4,0.5,0.6,0.4,0-0,0,1,0,89,89,100,0,1,0,1,99.2
28, Daniel Kilgore, Daniel Kilgore2012,2012,SF,C,45,2.2,0.1,0,2.1,0,0-0,0,0,0,3,3,100,0,0,0,0,100
29, Ted Larsen, Ted Larsen2012,2012,TB,C,621,1.8,4.3,0.5,1.1,-4.1,1-Jun,0,3,3,371,371,100,0,3,3,6,98.8
29, Lemuel Jeanpierre, Lemuel Jeanpierre2012,2012,SEA,C,41,1.8,-0.7,0,2.4,0.1,0-0,0,0,0,9,9,100,0,0,0,0,100
31, David Snow, David Snow2012,2012,BUF,C,129,1.4,0.8,0.5,-0.3,0.4,0-0,0,1,0,89,89,100,0,1,0,1,99.2
32, Joe Hawley, Joe Hawley2012,2012,ATL,C,20,0.9,0.2,0,0.7,0,0-0,0,0,0,8,1,12.5,0,0,0,0,100
33, Rich Ohrnberger, Rich Ohrnberger2012,2012,ARZ,C,106,0.8,-1.2,0,1.6,0.4,0-0,1,0,1,67,67,100,1,0,1,2,97.4
34, Gino Gradkowski, Gino Gradkowski2012,2012,BLT,C,73,0.7,0.9,0,0.6,-0.8,Jan-00,0,0,0,32,28,87.5,0,0,0,0,100
35, Thomas Austin, Thomas Austin2012,2012,CAR,C,77,0.3,0,0,0.1,0.2,0-0,0,0,0,37,37,100,0,0,0,0,100
36, Dylan Gandy, Dylan Gandy2012,2012,DET,C,1,0,0,0,0,0,0-0,0,0,0,#N/A,#N/A,#N/A,#N/A,#N/A,#N/A,#N/A,#N/A
36, David Molk, David Molk2012,2012,SD,C,2,0,0,0,0,0,0-0,0,0,0,#N/A,#N/A,#N/A,#N/A,#N/A,#N/A,#N/A,#N/A
38, Steve Vallos, Steve Vallos2012,2012,JAX,C,51,-0.1,0,0,-0.3,0.2,0-0,0,0,1,36,36,100,0,0,1,1,97.9
39, Peter Konz, Peter Konz2012,2012,ATL,C,7,-0.3,0.1,0,-0.4,0,0-0,0,0,0,2,1,50,0,0,0,0,100
40, C.J. Davis, C.J. Davis2012,2012,DEN,C,7,-0.4,0,0,-0.4,0,0-0,0,0,0,#N/A,#N/A,#N/A,#N/A,#N/A,#N/A,#N/A,#N/A
41, Josh Samuda, Josh Samuda2012,2012,MIA,C,4,-0.5,0,0,-0.5,0,0-0,0,0,0,1,1,100,0,0,0,0,100
42, Jeremy Zuttah, Jeremy Zuttah2012,2012,TB,C,454,-0.6,2.2,1.5,-1.7,-2.6,1-Apr,0,1,5,242,242,100,0,1,5,6,98.1
42, Jim Cordle, Jim Cordle2012,2012,NYG,C,17,-0.6,0.2,0,-0.3,-0.5,1-Jan,1,0,0,6,6,100,1,0,0,1,83.3
42, Kevin Matthews, Kevin Matthews2012,2012,TEN,C,79,-0.6,-1.3,0,0.5,0.2,0-0,0,1,0,43,43,100,0,1,0,1,98.3
42, Scott Wedige, Scott Wedige2012,2012,ARZ,C,17,-0.6,0.4,0,-1,0,0-0,0,0,0,14,14,100,0,0,0,0,100
46, Jeff Byers, Jeff Byers2012,2012,CAR,C,218,-0.7,-1,1,1.7,-2.4,1-Mar,2,1,2,106,106,100,2,1,2,5,96
47, Colin Baxter, Colin Baxter2012,2012,SD,C,6,-0.9,0.1,0,-1,0,0-0,0,0,0,5,5,100,0,0,0,0,100
48, Eric Wood, Eric Wood2012,2012,BUF,C,896,-1,2.9,2.5,-7.2,0.8,Feb-00,3,3,4,483,483,100,3,3,4,10,98.3
49, Russ Hochstein, Russ Hochstein2012,2012,KC,C,62,-1.4,-1,0,0.4,-0.8,Jan-00,0,1,1,35,35,100,0,1,1,2,95.7
50, Ryan Kalil, Ryan Kalil2012,2012,CAR,C,292,-1.7,1.4,1,-4.1,0,Jan-00,0,0,5,160,160,100,0,0,5,5,97.7
51, Trevor Robinson, Trevor Robinson2012,2012,CIN,C,457,-1.8,-3.1,0,1,0.3,Jan-00,1,3,6,232,231,99.6,1,3,6,10,96.6
52, Adam Snyder, Adam Snyder2012,2012,ARZ,C,180,-1.9,0.9,0,-3.4,0.6,0-0,0,0,2,107,106,99.1,0,0,2,2,98.6
53, Alex Parsons, Alex Parsons2012,2012,OAK,C,74,-2.1,-0.6,0,-1.7,0.2,0-0,0,1,2,50,50,100,0,1,2,3,95.5
54, Lyle Sendlein, Lyle Sendlein2012,2012,ARZ,C,775,-2.2,1.7,0.5,-5.7,1.3,1-Jan,3,2,6,489,489,100,3,2,6,11,98.2
55, Mike McGlynn, Mike McGlynn2012,2012,IND,C,70,-2.3,-1,0,-1.5,0.2,0-0,0,1,1,37,37,100,0,1,1,2,95.9
55, Doug Legursky, Doug Legursky2012,2012,PIT,C,246,-2.3,-0.8,0,-2.2,0.7,0-0,0,3,3,156,156,100,0,3,3,6,97.1
57, Kyle DeVan, Kyle DeVan2012,2012,TEN,C,125,-2.5,0.6,0,-3,-0.1,1-Jan,0,1,0,63,63,100,0,1,0,1,98.8
58, Jeff Saturday, Jeff Saturday2012,2012,GB,C,980,-5,6.5,0.5,-13.9,1.9,Jan-00,3,2,5,557,557,100,3,2,5,10,98.5
58, Kyle Cook, Kyle Cook2012,2012,CIN,C,162,-5,-0.4,0,-3.1,-1.5,Feb-00,2,0,2,99,98,99,2,0,2,4,96.4
60, Scott Wells, Scott Wells2012,2012,SL,C,434,-5.4,1.2,1,-6,-1.6,Mar-00,1,1,2,248,248,100,1,1,2,4,98.7
61, Roberto Garza, Roberto Garza2012,2012,CHI,C,1073,-5.6,1.9,1.5,-8.2,-0.8,Apr-00,5,1,8,558,558,100,5,1,8,14,97.9
62, Nick Hardwick, Nick Hardwick2012,2012,SD,C,1056,-6.1,-5.6,2.5,-2.3,-0.7,Apr-00,3,4,13,583,583,100,3,4,13,20,97.3
63, Geoff Hangartner, Geoff Hangartner2012,2012,CAR,C,536,-6.5,-1.9,0.5,-4.8,-0.3,1-Feb,1,2,10,290,290,100,1,2,10,13,96.6
64, Mackenzy Bernadeau, Mackenzy Bernadeau2012,2012,DAL,C,173,-6.8,-4,0,-2.4,-0.4,Jan-00,2,2,3,124,124,100,2,2,3,7,95.4
65, Samson Satele, Samson Satele2012,2012,IND,C,642,-7.1,-9,1,2.1,-1.2,Mar-00,6,7,8,404,404,100,6,7,8,21,95.7
66, Dallas Reynolds, Dallas Reynolds2012,2012,PHI,C,1020,-8.7,-7.7,1,-4.2,2.2,Jan-00,2,10,14,635,635,100,2,10,14,26,96.9
67, Brad Meester, Brad Meester2012,2012,JAX,C,1082,-11.5,-2.9,0.5,-10.3,1.2,Feb-00,3,3,15,662,662,100,3,3,15,21,97.5
68, Jeff Faine, Jeff Faine2012,2012,CIN,C,468,-13,-0.4,-0.5,-11,-1.1,Mar-00,1,0,5,276,276,100,1,0,5,6,98.3
1, Chris Myers, Chris Myers2011,2011,HST,C,1060,31,4.2,1,26.5,-0.7,1-Apr,1,2,8,492,492,100,1,2,8,11,98.3
2, Nick Mangold, Nick Mangold2011,2011,NYJ,C,928,27.1,6.4,0,20.9,-0.2,Mar-00,3,1,4,498,497,99.8,3,1,4,8,98.6
3, John Sullivan, John Sullivan2011,2011,MIN,C,956,23.5,3,1.5,17,2,Jan-00,4,2,6,534,534,100,4,2,6,12,98.1
4, Scott Wells, Scott Wells2011,2011,GB,C,1055,19.6,9.1,1.5,7.7,1.3,Feb-00,2,1,6,634,634,100,2,1,6,9,98.9
5, Jeff Saturday, Jeff Saturday2011,2011,IND,C,1001,15.6,6.9,1.5,5.8,1.4,Mar-00,2,0,9,576,576,100,2,0,9,11,98.5
6, Todd McClure, Todd McClure2011,2011,ATL,C,879,11.7,5.3,0,3.9,2.5,0-0,0,3,6,486,486,100,0,3,6,9,98.6
7, Ryan Kalil, Ryan Kalil2011,2011,CAR,C,1065,9.6,2.9,3.5,4,-0.8,1-Apr,3,2,7,599,599,100,3,2,7,12,98.4
8, Eric Wood, Eric Wood2011,2011,BUF,C,553,9.4,5.4,2.5,1.8,-0.3,Feb-00,0,1,2,301,301,100,0,1,2,3,99.3
9, Matt Birk, Matt Birk2011,2011,BLT,C,1088,9.3,8.2,0,1.7,-0.6,Apr-00,2,2,6,584,584,100,2,2,6,10,98.6
10, Alex Mack, Alex Mack2011,2011,CLV,C,1087,8.7,5.2,1.5,0.6,1.4,Mar-00,4,2,8,654,654,100,4,2,8,14,98.2
11, Brad Meester, Brad Meester2011,2011,JAX,C,1058,8.5,2.7,2,6.1,-2.3,3-Jun,2,1,13,538,537,99.8,2,1,13,16,97.7
12, Nick Hardwick, Nick Hardwick2011,2011,SD,C,1072,7.9,9.5,1,-4.9,2.3,Jan-00,0,2,7,602,602,100,0,2,7,9,98.9
13, Brian De La Puente, Brian De La Puente2011,2011,NO,C,945,7.6,4.9,3,-2.2,1.9,1-Feb,2,2,6,555,555,100,2,2,6,10,98.6
14, Casey Wiegmann, Casey Wiegmann2011,2011,KC,C,1087,6.4,7.1,1.5,-3.5,1.3,Feb-00,0,2,7,555,555,100,0,2,7,9,98.8
15, Lyle Sendlein, Lyle Sendlein2011,2011,ARZ,C,1054,4.9,-2.3,-0.5,5.4,2.3,Jan-00,1,1,18,630,630,100,1,1,18,20,97.6
16, Will Montgomery, Will Montgomery2011,2011,WAS,C,917,4.4,0.1,1,3.6,-0.3,1-Mar,0,4,11,518,518,100,0,4,11,15,97.8
16, Max Unger, Max Unger2011,2011,SEA,C,1028,4.4,7,0.5,-4.2,1.1,Feb-00,0,0,7,547,547,100,0,0,7,7,99
18, Samson Satele, Samson Satele2011,2011,OAK,C,925,3.9,0,2,6.1,-4.2,1-Aug,2,1,11,490,490,100,2,1,11,14,97.8
19, Joe Berger, Joe Berger2011,2011,MIN,C,101,3.5,0.7,0,3.5,-0.7,Jan-00,0,0,2,64,64,100,0,0,2,2,97.7
20, Ryan Wendell, Ryan Wendell2011,2011,NE,C,253,2.5,1.4,1,0.5,-0.4,Jan-00,0,1,1,125,125,100,0,1,1,2,98.8
21, Stefen Wisniewski, Stefen Wisniewski2011,2011,OAK,C,211,2.3,0.3,1.5,1.9,-1.4,Feb-00,2,0,2,87,87,100,2,0,2,4,96
22, Matt Tennant, Matt Tennant2011,2011,NO,C,43,2,0.3,0,1.5,0.2,0-0,0,0,0,8,8,100,0,0,0,0,100
23, Dan Koppen, Dan Koppen2011,2011,NE,C,33,0.8,0.5,0,0.2,0.1,0-0,0,0,0,18,18,100,0,0,0,0,100
23, Jamaal Jackson, Jamaal Jackson2011,2011,PHI,C,16,0.8,0.2,0,0.6,0,0-0,0,0,0,8,8,100,0,0,0,0,100
25, Nate Garner, Nate Garner2011,2011,MIA,C,12,0.7,0.1,0,0.6,0,0-0,0,0,0,4,1,25,0,0,0,0,100
26, Dylan Gandy, Dylan Gandy2011,2011,DET,C,9,0.6,0,0,0.6,0,0-0,0,0,0,1,1,100,0,0,0,0,100
26, Nick McDonald, Nick McDonald2011,2011,NE,C,106,0.6,0.2,0,0.1,0.3,0-0,1,0,0,66,66,100,1,0,0,1,98.5
28, Andre Gurode, Andre Gurode2011,2011,BLT,C,16,0.3,0.1,0,0.2,0,0-0,0,0,0,2,2,100,0,0,0,0,100
29, Evan Dietrich-Smith, Evan Dietrich-Smith2011,2011,GB,C,9,0.1,0,0,0.1,0,0-0,0,0,0,1,1,100,0,0,0,0,100
30, Fernando Velasco, Fernando Velasco2011,2011,TEN,C,1,0,0,0,0,0,0-0,0,0,0,1,1,100,0,0,0,0,100
30, Tyronne Green, Tyronne Green2011,2011,SD,C,1,0,0,0,0,0,0-0,0,0,0,#N/A,#N/A,#N/A,#N/A,#N/A,#N/A,#N/A,#N/A
30, Ted Larsen, Ted Larsen2011,2011,TB,C,3,0,0,0,0,0,0-0,0,0,0,#N/A,#N/A,#N/A,#N/A,#N/A,#N/A,#N/A,#N/A
33, Maurkice Pouncey, Maurkice Pouncey2011,2011,PIT,C,865,-0.2,0.8,0,-0.3,-0.7,1-Apr,3,2,8,486,486,100,3,1,8,12,98
34, Mike Pouncey, Mike Pouncey2011,2011,MIA,C,1025,-0.3,-4.5,1,4.1,-0.9,Apr-00,3,3,15,533,533,100,3,3,15,21,96.9
35, Mike Pollak, Mike Pollak2011,2011,IND,C,6,-0.4,0.1,0,0,-0.5,Jan-00,0,0,0,4,4,100,0,0,0,0,100
35, Bryan Mattison, Bryan Mattison2011,2011,BLT,C,7,-0.4,0,0,-0.4,0,0-0,0,0,0,#N/A,#N/A,#N/A,#N/A,#N/A,#N/A,#N/A,#N/A
35, Kraig Urbik, Kraig Urbik2011,2011,BUF,C,297,-0.4,4.2,0.5,-3.9,-1.2,1-Feb,0,0,1,195,195,100,0,0,1,1,99.6
38, Colin Brown, Colin Brown2011,2011,BUF,C,118,-0.5,1,1,-2.8,0.3,0-0,0,0,1,75,75,100,0,0,1,1,99
38, Lemuel Jeanpierre, Lemuel Jeanpierre2011,2011,SEA,C,55,-0.5,0,0,0.3,-0.8,1-Jan,0,0,0,35,35,100,0,0,0,0,100
40, Kevin Kowalski, Kevin Kowalski2011,2011,DAL,C,73,-0.6,1.4,0,-1.2,-0.8,Jan-00,0,0,0,53,53,100,0,0,0,0,100
41, Trai Essex, Trai Essex2011,2011,PIT,C,54,-0.7,-0.4,0,-0.5,0.2,0-0,0,0,1,22,22,100,0,0,1,1,96.6
42, Ryan Cook, Ryan Cook2011,2011,MIA,C,15,-0.8,0.2,0,-1,0,0-0,0,0,0,8,8,100,0,0,0,0,100
43, Thomas Austin, Thomas Austin2011,2011,HST,C,40,-1,-0.9,0,-0.2,0.1,0-0,1,0,1,21,21,100,1,0,1,2,91.7
44, Colin Baxter, Colin Baxter2011,2011,SD,C,40,-1.1,-1,-0.5,0.3,0.1,0-0,0,1,0,99,99,100,0,1,1,2,98.5
45, Jonathan Goodwin, Jonathan Goodwin2011,2011,SF,C,1060,-2.2,-7.1,0.5,3.1,1.3,Feb-00,5,5,13,519,519,100,5,5,13,23,96.4
45, Andy Levitre, Andy Levitre2011,2011,BUF,C,67,-2.2,0.3,0.5,-3.2,0.2,0-0,0,0,0,49,49,100,0,0,0,0,100
47, Jason Brown, Jason Brown2011,2011,SL,C,584,-2.3,-0.7,0,-2.3,0.7,Jan-00,2,2,7,344,344,100,2,2,7,11,97.5
47, Jeremy Zuttah, Jeremy Zuttah2011,2011,TB,C,46,-2.3,-0.6,0,-0.8,-0.9,Jan-00,0,0,2,31,31,100,0,0,2,2,95.2
49, Dominic Raiola, Dominic Raiola2011,2011,DET,C,1134,-2.6,7.6,1,-9.8,-1.4,Jun-00,4,0,10,713,713,100,4,0,10,14,98.4
50, Kyle Cook, Kyle Cook2011,2011,CIN,C,1100,-3.1,-2.9,0.5,2,-2.7,2-Jun,1,4,13,584,584,100,1,4,13,18,97.6
51, Dan Connolly, Dan Connolly2011,2011,NE,C,784,-4,-6.1,1.5,-0.8,1.4,Jan-00,1,6,12,455,455,100,1,6,12,19,96.8
52, Kevin Boothe, Kevin Boothe2011,2011,NYG,C,416,-4.1,-0.9,0,-4.4,1.2,0-0,1,1,3,240,239,99.6,1,1,3,5,98.3
53, Erik Cook, Erik Cook2011,2011,WAS,C,181,-5.2,-2.6,0,-1.2,-1.4,Feb-00,1,0,5,124,124,100,1,0,5,6,96.2
54, Doug Legursky, Doug Legursky2011,2011,PIT,C,201,-6.5,-3.9,0,-2.2,-0.4,Jan-00,0,3,6,108,108,100,0,3,6,9,93.8
55, Tony Wragge, Tony Wragge2011,2011,SL,C,508,-7.4,-2.5,1,-3.5,-2.4,Apr-00,2,0,8,273,273,100,2,0,8,10,97.1
56, David Baas, David Baas2011,2011,NYG,C,695,-8.2,-2.5,0.5,-6.3,0.1,Feb-00,2,4,6,389,389,100,2,4,6,12,97.6
57, Olin Kreutz, Olin Kreutz2011,2011,NO,C,227,-8.8,-1.1,-0.5,-5.3,-1.9,1-Mar,0,0,6,145,145,100,0,0,6,6,96.9
58, Joe Hawley, Joe Hawley2011,2011,ATL,C,230,-9.1,1.4,0,-8.2,-2.3,Mar-00,1,1,1,139,139,100,1,1,1,3,98.2
58, Colin Baxter, Colin Baxter2011,2011,NYJ,C,176,-9.1,-0.2,0,-8.4,-0.5,Jan-00,0,1,1,99,99,100,0,1,1,2,98.5
60, Phil Costa, Phil Costa2011,2011,DAL,C,1024,-9.3,-5.8,-2,-2.6,1.1,Feb-00,3,3,15,581,581,100,3,3,15,21,97.2
61, Jeff Faine, Jeff Faine2011,2011,TB,C,943,-10,0.8,0,-10.7,-0.1,Mar-00,2,3,10,584,584,100,2,3,10,15,98
62, Eugene Amano, Eugene Amano2011,2011,TEN,C,1044,-12.7,3.6,1.5,-17,-0.8,Apr-00,4,4,6,618,618,100,4,4,6,14,98.1
63, Jason Kelce, Jason Kelce2011,2011,PHI,C,1095,-13.8,-11.4,3,-4.1,-1.3,May-00,1,6,26,651,651,100,1,6,26,33,96.2
64, Roberto Garza, Roberto Garza2011,2011,CHI,C,1045,-18.7,-4,0.5,-16,0.8,1-Mar,1,2,15,550,550,100,1,2,15,18,97.5
65, J.D. Walton, J.D. Walton2011,2011,DEN,C,1083,-28,-4.6,-0.5,-23.2,0.3,Mar-00,4,4,15,509,509,100,4,4,15,23,96.4
1, Matt Birk, Matt Birk2010,2010,BLT,C,1091,27.8,9,-0.5,18,1.3,Feb-00,1,0,5,542,542,100,1,0,5,6,99.1
2, Nick Mangold, Nick Mangold2010,2010,NYJ,C,1068,26.1,7.2,0,17.7,1.2,Feb-00,1,1,6,544,539,99.1,1,1,6,8,98.8
3, Chris Myers, Chris Myers2010,2010,HST,C,1081,22.1,-1.8,3,17.4,3.5,0-0,1,3,16,611,611,100,1,3,16,20,97.5
4, Jeff Saturday, Jeff Saturday2010,2010,IND,C,1156,17.9,10.6,0,9,-1.7,May-00,0,2,6,697,697,100,0,2,6,8,99.1
5, Brad Meester, Brad Meester2010,2010,JAX,C,1081,16.3,1,2,15.1,-1.8,2-May,2,6,8,536,525,97.9,2,6,8,16,97.6
6, Andre Gurode, Andre Gurode2010,2010,DAL,C,1105,14.9,5,3.5,9.2,-2.8,1-Jul,1,2,8,641,630,98.3,1,2,8,11,98.7
7, Ryan Kalil, Ryan Kalil2010,2010,CAR,C,1016,11.8,1.9,1.5,8.7,-0.3,2-May,5,1,10,552,543,98.4,5,1,10,16,97.6
8, Scott Wells, Scott Wells2010,2010,GB,C,1053,9.9,0.4,2.5,4.8,2.2,Jan-00,1,3,12,625,625,100,1,3,12,16,98
9, Alex Mack, Alex Mack2010,2010,CLV,C,975,9.2,2.5,0.5,5.8,0.4,Mar-00,2,2,9,533,524,98.3,2,2,9,13,98
10, Kyle Cook, Kyle Cook2010,2010,CIN,C,1126,7.5,-2.3,0.5,8.1,1.2,Feb-00,3,3,12,626,626,100,3,3,12,18,97.7
11, Dan Koppen, Dan Koppen2010,2010,NE,C,1024,7,-3,1,8.8,0.2,Mar-00,3,2,16,531,526,99.1,3,2,16,21,96.9
12, Rich Seubert, Rich Seubert2010,2010,NYG,C,421,5.2,1.2,1,1.6,1.4,1-Jan,0,2,3,209,208,99.5,0,2,3,5,98.2
13, Todd McClure, Todd McClure2010,2010,ATL,C,1153,4.8,-7.8,-0.5,10.2,2.9,1-Jan,1,4,23,615,608,98.9,1,4,23,28,96.5
14, David Baas, David Baas2010,2010,SF,C,968,3.7,-5.7,2.5,5.8,1.1,Feb-00,3,6,15,551,537,97.5,3,6,15,24,96.5
15, Casey Wiegmann, Casey Wiegmann2010,2010,KC,C,1127,2.7,-2.7,-1,4.5,1.9,1-Feb,0,9,13,528,528,100,0,9,13,22,96.9
16, Robert Turner, Robert Turner2010,2010,NYJ,C,77,2.2,-0.9,0,2.9,0.2,0-0,0,0,2,21,20,95.2,0,0,2,2,92.5
17, Lyle Sendlein, Lyle Sendlein2010,2010,ARZ,C,982,1.8,8.1,-1,-5.4,0.1,Mar-00,2,0,5,622,613,98.6,2,0,5,7,99.1
18, Nick Hardwick, Nick Hardwick2010,2010,SD,C,1080,1.6,2.5,0.5,-3.3,1.9,Feb-00,2,1,10,592,585,98.8,2,1,10,13,98.2
19, Joe Berger, Joe Berger2010,2010,MIA,C,976,1.5,1.4,-0.5,-0.5,1.1,Feb-00,2,3,11,551,549,99.6,2,3,11,16,97.7
20, Shaun O'Hara, Shaun O'Hara2010,2010,NYG,C,407,1,-2.3,0.5,1.6,1.2,0-0,2,2,5,204,204,100,2,2,5,9,96.4
20, Eric Wood, Eric Wood2010,2010,BUF,C,242,1,0.4,1,-0.2,-0.2,Jan-00,1,1,1,128,121,94.5,1,1,1,3,97.9
22, Doug Legursky, Doug Legursky2010,2010,PIT,C,43,0.6,0.4,0,1,-0.8,Jan-00,0,0,0,18,18,100,0,0,0,0,100
23, Tony Wragge, Tony Wragge2010,2010,SF,C,44,0.5,-0.1,0,0.5,0.1,0-0,0,0,1,15,14,93.3,0,0,1,1,94.6
24, Scott Mruczkowski, Scott Mruczkowski2010,2010,SD,C,24,0.4,0,0,0.4,0,0-0,0,0,0,1,1,100,0,0,0,0,100
25, Matt Tennant, Matt Tennant2010,2010,NO,C,14,0.3,0.1,0,0.2,0,0-0,0,0,0,5,5,100,0,0,0,0,100
26, Jason Spitz, Jason Spitz2010,2010,GB,C,12,0.1,0,0,0.1,0,0-0,0,0,0,1,1,100,0,0,0,0,100
27, Rex Hadnot, Rex Hadnot2010,2010,ARZ,C,1,0,0,0,0,0,0-0,0,0,0,1,1,100,0,0,0,0,100
28, Cory Procter, Cory Procter2010,2010,MIA,C,18,-0.2,0.1,0,-0.3,0,0-0,0,0,0,5,5,100,0,0,0,0,100
29, Fernando Velasco, Fernando Velasco2010,2010,TEN,C,184,-0.3,-1.1,0,1.2,-0.4,Jan-00,0,1,3,105,105,100,0,1,3,4,97.1
30, Jeremy Zuttah, Jeremy Zuttah2010,2010,TB,C,556,-0.4,5.3,0.5,-5,-1.2,Apr-00,0,0,3,320,312,97.5,0,0,3,3,99.3
30, Kraig Urbik, Kraig Urbik2010,2010,BUF,C,44,-0.4,0.6,0,-1.1,0.1,0-0,0,0,0,22,22,100,0,0,0,0,100
32, Jamaal Jackson, Jamaal Jackson2010,2010,PHI,C,20,-0.5,-0.7,0,0.1,0.1,0-0,1,0,0,9,9,100,1,0,0,1,88.9
33, Ryan Cook, Ryan Cook2010,2010,MIN,C,97,-0.6,1.3,0,-1.2,-0.7,Jan-00,0,0,0,45,44,97.8,0,0,0,0,100
34, Joe Hawley, Joe Hawley2010,2010,ATL,C,18,-1,0.2,0,-1.3,0.1,0-0,0,0,0,7,7,100,0,0,0,0,100
35, Will Montgomery, Will Montgomery2010,2010,WAS,C,94,-1.6,-0.5,0.5,-0.9,-0.7,Jan-00,0,0,2,54,54,100,0,0,2,2,97.2
36, Jon Cooper, Jon Cooper2010,2010,MIN,C,153,-1.7,-0.8,0,-1.4,0.5,0-0,0,2,1,79,78,98.7,0,2,1,3,97.1
37, Kevin Boothe, Kevin Boothe2010,2010,NYG,C,55,-2.1,-0.3,0.5,-2.5,0.2,0-0,0,1,1,26,26,100,0,0,1,1,97.1
38, Richie Incognito, Richie Incognito2010,2010,MIA,C,139,-2.4,-1.2,0,-1.7,0.5,0-0,0,1,3,89,85,95.5,0,1,3,4,96.5
39, Nick Cole, Nick Cole2010,2010,PHI,C,71,-2.7,-1.3,0,-1.6,0.2,0-0,1,0,1,44,44,100,1,0,1,2,96
40, Kevin Matthews, Kevin Matthews2010,2010,TEN,C,66,-2.9,-1.5,0,-1.6,0.2,0-0,0,0,3,40,40,100,0,0,3,3,94.4
41, Maurkice Pouncey, Maurkice Pouncey2010,2010,PIT,C,1009,-3,-7.3,-0.5,3.6,1.2,1-Feb,3,4,17,515,510,99,3,4,17,24,96.3
42, Jared Veldheer, Jared Veldheer2010,2010,OAK,C,75,-3.2,-0.4,0,-1.5,-1.3,Feb-00,0,1,0,46,46,100,0,1,0,1,98.4
43, Samson Satele, Samson Satele2010,2010,OAK,C,1010,-3.8,-3.1,3,-2.6,-1.1,Apr-00,2,3,10,515,496,96.3,2,3,10,15,97.6
44, Jonathan Goodwin, Jonathan Goodwin2010,2010,NO,C,1112,-4.3,-2.7,-1,-3,2.4,Jan-00,2,3,15,685,685,100,2,3,15,20,97.7
45, Ted Larsen, Ted Larsen2010,2010,TB,C,130,-5.2,-5.5,0,1.9,-1.6,Feb-00,1,0,6,70,68,97.1,1,0,6,7,91.9
46, Geoff Hangartner, Geoff Hangartner2010,2010,BUF,C,726,-5.9,0.3,1,-7.5,0.3,Feb-00,3,4,5,439,428,97.5,3,4,5,12,97.7
47, Mike McGlynn, Mike McGlynn2010,2010,PHI,C,1066,-6,-5.8,-2,1.7,0.1,Mar-00,2,6,19,660,660,100,2,6,19,27,96.9
48, Adam Koets, Adam Koets2010,2010,NYG,C,253,-6.8,-2.8,0,-1.7,-2.3,Mar-00,0,3,5,141,138,97.9,0,3,5,8,95.7
49, John Sullivan, John Sullivan2010,2010,MIN,C,819,-8.3,-4.1,1,-7.6,2.4,0-0,3,1,12,439,431,98.2,3,1,12,16,97
50, Jeff Faine, Jeff Faine2010,2010,TB,C,440,-10,-10.3,0,-0.2,0.5,Jan-00,1,1,14,234,217,92.7,1,1,14,16,94.4
51, Chris Spencer, Chris Spencer2010,2010,SEA,C,1024,-11.3,-2.7,0,-7.8,-0.8,May-00,3,4,11,598,586,98,3,4,11,18,97.6
52, Casey Rabach, Casey Rabach2010,2010,WAS,C,998,-12.6,0.6,0.5,-13.8,0.1,Mar-00,1,4,14,625,625,100,1,4,14,19,97.7
53, Dominic Raiola, Dominic Raiola2010,2010,DET,C,1138,-13.4,-5.6,1.5,-5.7,-3.6,Jul-00,2,1,22,688,688,100,2,1,22,25,97.2
54, J.D. Walton, J.D. Walton2010,2010,DEN,C,1086,-15.9,-6.9,5,-11.8,-2.2,Jul-00,2,3,20,643,632,98.3,2,3,20,25,97
55, Olin Kreutz, Olin Kreutz2010,2010,CHI,C,1007,-17.9,1.7,0.5,-16.7,-3.4,1-Jul,1,2,10,551,535,97.1,1,2,10,13,98.1
56, Jason Brown, Jason Brown2010,2010,SL,C,1134,-18.1,1.4,1,-18.5,-2,1-Jun,1,0,11,640,627,98,1,0,11,12,98.5
57, Eugene Amano, Eugene Amano2010,2010,TEN,C,727,-25.6,-5.9,-0.5,-18.5,-0.7,Mar-00,1,2,15,369,363,98.4,1,2,15,18,96.2
1, Nick Mangold, Nick Mangold2009,2009,NYJ,C,1080,36.3,5.7,0,29.8,0.8,Mar-00,1,1,5,438,438,100,1,1,5,7,98.7
2, Matt Birk, Matt Birk2009,2009,BLT,C,1047,22.9,4.1,2,16,0.8,Mar-00,2,2,10,552,552,100,2,2,10,14,98
3, Ryan Kalil, Ryan Kalil2009,2009,CAR,C,1076,22.8,5.6,0.5,17,-0.3,1-Apr,2,2,6,508,508,100,2,2,6,10,98.4
4, Shaun O'Hara, Shaun O'Hara2009,2009,NYG,C,1079,22.5,4,2,15.9,0.6,1-May,1,4,10,585,585,100,1,4,10,15,98
5, Jake Grove, Jake Grove2009,2009,MIA,C,693,21.4,5.3,2,17,-2.9,Jun-00,0,1,5,338,338,100,0,1,5,6,98.7
6, Alex Mack, Alex Mack2009,2009,CLV,C,1016,21,1.4,2,15.8,1.8,1-Feb,1,2,10,479,479,100,1,2,10,13,97.9
7, Jamaal Jackson, Jamaal Jackson2009,2009,PHI,C,926,19.7,3.1,2,11.8,2.8,0-0,2,0,8,537,537,100,2,0,8,10,98.5
8, Chris Myers, Chris Myers2009,2009,HST,C,1083,17.1,2.8,3.5,8.6,2.2,Jan-00,1,4,13,637,637,100,1,4,13,18,97.8
9, Scott Mruczkowski, Scott Mruczkowski2009,2009,SD,C,860,15.1,4.2,5.5,5.7,-0.3,1-Mar,1,1,9,463,463,100,1,1,9,11,98.2
10, Todd McClure, Todd McClure2009,2009,ATL,C,1082,14.9,4.6,0.5,9.6,0.2,Mar-00,1,6,7,591,591,100,1,6,7,14,98.2
11, Jeff Saturday, Jeff Saturday2009,2009,IND,C,1013,14.7,9.9,2,2.7,0.1,1-Mar,1,1,6,600,600,100,1,1,6,8,99
12, Andre Gurode, Andre Gurode2009,2009,DAL,C,1093,14.3,0.2,0,18.3,-4.2,2-Sep,2,5,10,594,594,100,2,5,10,17,97.8
13, Joe Berger, Joe Berger2009,2009,MIA,C,459,11.5,3.3,-0.5,7.3,1.4,0-0,0,1,4,259,258,99.6,0,1,4,5,98.5
14, Dominic Raiola, Dominic Raiola2009,2009,DET,C,1103,11.1,3.7,1.5,7,-1.1,May-00,2,6,9,660,660,100,2,6,9,17,98
15, Jonathan Goodwin, Jonathan Goodwin2009,2009,NO,C,1039,11,4.3,2,3.6,1.1,Feb-00,1,1,12,548,548,100,1,1,12,14,98
16, Olin Kreutz, Olin Kreutz2009,2009,CHI,C,1035,10.3,6.7,5,1.5,-2.9,Jun-00,2,1,6,617,617,100,2,1,6,9,98.8
17, Eric Heitmann, Eric Heitmann2009,2009,SF,C,1005,7.4,4,0.5,1.8,1.1,Feb-00,2,1,10,585,585,100,2,1,10,13,98.2
18, Dan Koppen, Dan Koppen2009,2009,NE,C,1099,6.4,0.3,1,6.7,-1.6,May-00,0,8,9,597,597,100,0,8,9,17,97.9
19, Scott Wells, Scott Wells2009,2009,GB,C,1001,5.2,3,2.5,1.7,-2,May-00,2,2,8,581,581,100,2,2,8,12,98.4
20, Steve Vallos, Steve Vallos2009,2009,SEA,C,141,4,1.1,0,2.5,0.4,0-0,0,0,1,83,83,100,0,0,1,1,99.1
21, Chris Spencer, Chris Spencer2009,2009,SEA,C,749,3.9,4,1,-0.7,-0.4,Mar-00,2,0,6,465,465,100,2,0,6,8,98.6
21, Kyle Cook, Kyle Cook2009,2009,CIN,C,1093,3.9,0.5,0.5,2.8,0.1,Mar-00,1,4,11,524,524,100,1,4,11,16,97.7
23, Dan Connolly, Dan Connolly2009,2009,NE,C,54,2.2,0.7,0,1.4,0.1,0-0,0,0,0,23,22,95.7,0,0,0,0,100
24, Dennis Norman, Dennis Norman2009,2009,SD,C,69,2.1,0.9,0.5,0.6,0.1,0-0,0,0,0,35,34,97.1,0,0,0,0,100
25, Brett Romberg, Brett Romberg2009,2009,ATL,C,35,0.9,0.5,0,0.3,0.1,0-0,0,0,0,19,19,100,0,0,0,0,100
26, Nick Hardwick, Nick Hardwick2009,2009,SD,C,119,0.6,0.4,0,-0.2,0.4,0-0,1,0,1,66,66,100,1,0,1,2,97.3
27, Lyle Sendlein, Lyle Sendlein2009,2009,ARZ,C,1052,0.5,-1.9,0.5,1.8,0.1,Mar-00,1,8,12,628,628,100,1,8,12,21,97.5
28, Jamey Richard, Jamey Richard2009,2009,IND,C,31,0.3,0.5,0,-0.3,0.1,0-0,0,0,0,19,19,100,0,0,0,0,100
28, Jonathan Compas, Jonathan Compas2009,2009,TB,C,12,0.3,0.3,0,0,0,0-0,0,0,0,10,10,100,0,0,0,0,100
30, Nick Leckey, Nick Leckey2009,2009,NO,C,50,0.2,0.6,0,-0.5,0.1,0-0,0,0,0,21,21,100,0,0,0,0,100
31, Ryan Cook, Ryan Cook2009,2009,MIN,C,4,0.1,0,0,0.1,0,0-0,0,0,0,#N/A,#N/A,#N/A,#N/A,#N/A,#N/A,#N/A,#N/A
31, Evan Dietrich-Smith, Evan Dietrich-Smith2009,2009,GB,C,28,0.1,0.2,0,0.3,-0.4,Jan-00,0,0,0,6,6,100,0,0,0,0,100
33, Jamar Nesbit, Jamar Nesbit2009,2009,NO,C,3,0,0,0,0,0,0-0,0,0,0,#N/A,#N/A,#N/A,#N/A,#N/A,#N/A,#N/A,#N/A
33, Jason Brown, Jason Brown2009,2009,SL,C,1013,0,7.5,-0.5,-6.6,-0.4,1-Apr,1,1,5,564,564,100,1,1,5,7,99
33, Doug Legursky, Doug Legursky2009,2009,PIT,C,2,0,0,0,0,0,0-0,0,0,0,#N/A,#N/A,#N/A,#N/A,#N/A,#N/A,#N/A,#N/A
33, Jonathan Luigs, Jonathan Luigs2009,2009,CIN,C,3,0,0,0,0,0,0-0,0,0,0,#N/A,#N/A,#N/A,#N/A,#N/A,#N/A,#N/A,#N/A
37, Max Unger, Max Unger2009,2009,SEA,C,213,-0.2,-1.1,1,-0.7,0.6,0-0,1,2,2,124,124,100,1,2,2,5,96.8
38, David Hale, David Hale2009,2009,BLT,C,6,-0.3,0.1,0,-0.4,0,0-0,0,0,0,2,2,100,0,0,0,0,100
39, Casey Wiegmann, Casey Wiegmann2009,2009,DEN,C,1096,-0.8,1.3,-2,2.6,-2.7,1-Jun,1,1,14,603,603,100,1,1,14,16,98
39, Wade Smith, Wade Smith2009,2009,KC,C,68,-0.8,-1.5,0,1.5,-0.8,Jan-00,1,1,0,35,35,100,1,1,0,2,95
41, Cory Procter, Cory Procter2009,2009,DAL,C,5,-0.9,0.1,0,-1,0,0-0,0,0,0,3,3,100,0,0,0,0,100
42, Chris Chester, Chris Chester2009,2009,BLT,C,20,-1,0.1,0,-1.2,0.1,0-0,0,0,0,3,3,100,0,0,0,0,100
43, Mark Setterstrom, Mark Setterstrom2009,2009,SL,C,89,-1.2,-1.9,0.5,-0.1,0.3,0-0,0,0,4,57,57,100,0,0,4,4,94.7
44, Jason Spitz, Jason Spitz2009,2009,GB,C,58,-1.5,-0.1,0,-0.6,-0.8,Jan-00,0,0,1,34,34,100,0,0,1,1,97.8
45, Nick Cole, Nick Cole2009,2009,PHI,C,129,-1.6,-0.7,-1,-0.3,0.4,0-0,1,0,2,81,81,100,1,0,2,3,96.9
46, Casey Rabach, Casey Rabach2009,2009,WAS,C,1026,-2.1,1,0,-0.8,-2.3,2-Jul,1,4,12,603,603,100,1,4,12,17,97.8
46, Sean Mahan, Sean Mahan2009,2009,TB,C,259,-2.1,-0.7,0.5,-2.7,0.8,0-0,0,4,1,169,169,100,0,4,1,5,97.8
48, Samson Satele, Samson Satele2009,2009,OAK,C,744,-4.8,-4,0.5,-1.5,0.2,1-Feb,2,4,11,422,422,100,2,4,11,17,96.9
49, Geoff Hangartner, Geoff Hangartner2009,2009,BUF,C,983,-6,-9,-1,4.9,-0.9,Apr-00,3,2,16,515,515,100,3,2,16,21,96.8
50, John Sullivan, John Sullivan2009,2009,MIN,C,1126,-7.2,2.3,-1.5,-9,1,1-Apr,4,4,7,592,592,100,4,4,7,15,97.9
51, Rudy Niswanger, Rudy Niswanger2009,2009,KC,C,1040,-9,1.6,-0.5,-7.2,-2.9,3-Jun,1,3,11,581,581,100,1,3,11,15,98
